{
  "contractVersion": "btb-match-statistics.v1",
  "modelRegime": "BTB_RB1_20261018",
  "matchKey": "2026-10-21:3225759:22:00:00",
  "asOf": "2026-10-22T07:43:39.321Z",
  "availability": "UNAVAILABLE",
  "reason": "STATISTICS_STALE",
  "observedAt": null,
  "source": "VERIFIED_RB1_OBSERVATION",
  "captureId": null,
  "pressurePolicy": null,
  "phase": null,
  "elapsed": null,
  "homeScore": null,
  "awayScore": null,
  "xgScopeVerified": false,
  "statistics": {
    "homeTotalShots": null,
    "awayTotalShots": null,
    "homeShotsOnTarget": null,
    "awayShotsOnTarget": null,
    "homeCorners": null,
    "awayCorners": null,
    "homeXg": null,
    "awayXg": null,
    "homeBallPossession": null,
    "awayBallPossession": null,
    "homeYellowCards": null,
    "awayYellowCards": null,
    "homeRedCards": null,
    "awayRedCards": null,
    "homeBoxTouches": null,
    "awayBoxTouches": null,
    "homeBlockedShots": null,
    "awayBlockedShots": null,
    "homeGoalkeeperSaves": null,
    "awayGoalkeeperSaves": null
  },
  "coverage": [],
  "pressure": null
}
